{
  "schemaVersion": "1.0",
  "id": "freezer-main",
  "name": "Main Lab Freezer",
  "shelves": [
    {
      "id": "shelf-1",
      "name": "Shelf 1",
      "racks": [
        {
          "id": "rack-1-1",
          "name": "Rack 1",
          "boxSlots": [
            {
              "row": 1,
              "column": 1,
              "box": {
                "id": "box-1-1-1",
                "name": "Box A1",
                "rows": 9,
                "columns": 9,
                "positions": [
                  {
                    "id": "pos-1",
                    "label": "A1",
                    "row": 1,
                    "column": 1,
                    "sampleId": "sample-001"
                  },
                  {
                    "id": "pos-2",
                    "label": "A2",
                    "row": 1,
                    "column": 2,
                    "sampleId": "sample-002"
                  },
                  {
                    "id": "pos-3",
                    "label": "A3",
                    "row": 1,
                    "column": 3
                  },
                  {
                    "id": "pos-10",
                    "label": "B1",
                    "row": 2,
                    "column": 1,
                    "sampleId": "sample-010"
                  },
                  {
                    "id": "pos-11",
                    "label": "B2",
                    "row": 2,
                    "column": 2
                  }
                ]
              }
            },
            {
              "row": 1,
              "column": 2,
              "box": null
            },
            {
              "row": 1,
              "column": 3,
              "box": {
                "id": "box-1-1-3",
                "name": "Box C1",
                "rows": 9,
                "columns": 9,
                "positions": [
                  {
                    "id": "pos-1",
                    "label": "A1",
                    "row": 1,
                    "column": 1,
                    "sampleId": "sample-100"
                  },
                  {
                    "id": "pos-2",
                    "label": "A2",
                    "row": 1,
                    "column": 2
                  }
                ]
              }
            },
            {
              "row": 1,
              "column": 4,
              "box": null
            },
            {
              "row": 2,
              "column": 1,
              "box": null
            },
            {
              "row": 2,
              "column": 2,
              "box": null
            },
            {
              "row": 2,
              "column": 3,
              "box": null
            },
            {
              "row": 2,
              "column": 4,
              "box": null
            },
            {
              "row": 3,
              "column": 1,
              "box": null
            },
            {
              "row": 3,
              "column": 2,
              "box": null
            },
            {
              "row": 3,
              "column": 3,
              "box": null
            },
            {
              "row": 3,
              "column": 4,
              "box": null
            },
            {
              "row": 4,
              "column": 1,
              "box": null
            },
            {
              "row": 4,
              "column": 2,
              "box": null
            },
            {
              "row": 4,
              "column": 3,
              "box": null
            },
            {
              "row": 4,
              "column": 4,
              "box": {
                "id": "box-1-1-16",
                "name": "Box D4",
                "rows": 9,
                "columns": 9,
                "positions": [
                  {
                    "id": "pos-1",
                    "label": "A1",
                    "row": 1,
                    "column": 1,
                    "sampleId": "sample-500"
                  },
                  {
                    "id": "pos-2",
                    "label": "A2",
                    "row": 1,
                    "column": 2,
                    "sampleId": "sample-501"
                  },
                  {
                    "id": "pos-3",
                    "label": "A3",
                    "row": 1,
                    "column": 3
                  }
                ]
              }
            }
          ]
        },
        {
          "id": "rack-1-2",
          "name": "Rack 2",
          "boxSlots": [
            {
              "row": 1,
              "column": 1,
              "box": null
            },
            {
              "row": 1,
              "column": 2,
              "box": null
            },
            {
              "row": 1,
              "column": 3,
              "box": null
            },
            {
              "row": 1,
              "column": 4,
              "box": null
            },
            {
              "row": 2,
              "column": 1,
              "box": null
            },
            {
              "row": 2,
              "column": 2,
              "box": null
            },
            {
              "row": 2,
              "column": 3,
              "box": null
            },
            {
              "row": 2,
              "column": 4,
              "box": null
            },
            {
              "row": 3,
              "column": 1,
              "box": null
            },
            {
              "row": 3,
              "column": 2,
              "box": null
            },
            {
              "row": 3,
              "column": 3,
              "box": null
            },
            {
              "row": 3,
              "column": 4,
              "box": null
            },
            {
              "row": 4,
              "column": 1,
              "box": null
            },
            {
              "row": 4,
              "column": 2,
              "box": null
            },
            {
              "row": 4,
              "column": 3,
              "box": null
            },
            {
              "row": 4,
              "column": 4,
              "box": null
            }
          ]
        }
      ]
    }
  ]
}
